headline,link
SA stocks at three-month high,https://www.moneyweb.co.za/news/markets/sa-stocks-rise-as-biden-win-amps-up-risk-appetite/
Anglo to defend class action suit over lead poisoning in Zambia,https://www.moneyweb.co.za/mineweb/anglo-to-defend-class-action-suit-over-lead-poisoning-in-zambia/
SA stocks gain as Richemont gets luxury peer boost,https://www.moneyweb.co.za/news-fast-news/sa-stocks-gain-as-richemont-gets-luxury-peer-boost/
"SA stocks climb as AngloGold, Gold Fields lead gains",https://www.moneyweb.co.za/news-fast-news/sa-stocks-climb-as-anglogold-gold-fields-lead-gains/
"ARC se netto batewaarde groei, maar diskonto raak al hoe groter",https://www.moneyweb.co.za/moneyweb-radio/rsg-geldsake/arc-se-netto-batewaarde-groei-maar-diskonto-raak-al-hoe-groter/
Stocks rise as vaccine hopes spur risk-on sentiment,https://www.moneyweb.co.za/news-fast-news/stocks-rise-as-vaccine-hopes-spur-risk-on-sentiment/
Stocks pulled lower as iron ore miners outweigh gold,https://www.moneyweb.co.za/news/markets/stocks-pulled-lower-as-iron-ore-miners-outweigh-gold/
"Stocks rise as Anglo, miners ride sentiment boost",https://www.moneyweb.co.za/news-fast-news/stocks-rise-as-anglo-miners-ride-sentiment-boost/
Stocks retreat as banks fall; Shoprite soars on update,https://www.moneyweb.co.za/news-fast-news/stocks-retreat-as-banks-fall-shoprite-soars-on-update/
"Stocks drop as gold frenzy pauses, Richemont slips",https://www.moneyweb.co.za/news-fast-news/stocks-drop-as-gold-frenzy-pauses-richemont-slips/
Is the rising gold price a self-fulfilling prophecy?,https://www.moneyweb.co.za/investing/commodities/is-the-rising-gold-price-a-self-fulfilling-prophecy/
Where are the risks lurking on the JSE?,https://www.moneyweb.co.za/investing/where-are-the-risks-lurking-on-the-jse/
Mines forced to overhaul their supply chains,https://www.moneyweb.co.za/news/south-africa/mines-forced-to-overhaul-their-supply-chains/
FNB en Absa gee kliënte en ondernemings betaalvakansies,https://www.moneyweb.co.za/moneyweb-radio/fnb-en-absa-gee-kliente-en-ondernemings-betaalvakansies/
Motsepe Foundation and Sanlam pledge R1bn to fight Covid-19 crisis,https://www.moneyweb.co.za/news/south-africa/motsepe-foundation-and-sanlam-pledge-r1bn-to-fight-covid-19-crisis/
