sens_title,Date,text
OML12,11 Nov 2020,"New financial instrument listing : OML12

OLD MUTUAL LIFE ASSURANCE COMPANY (SOUTH AFRICA) LIMITED
Registration number 1999/004643/06
JSE alpha code: BOLDM
(“OMLACSA”)

NEW FINANCIAL INSTRUMENT LISTING

The JSE Limited has granted a listing to OMLACSA of its unsecured floating rate note in terms of its
R25,000,000,000 Multi-Issuer Note Programme (“the Programme”), as guaranteed by Old Mutual Limited,
dated 4 March 2020.

New Instrument                                 OML12

Authorised programme size:                     R25,000,000,000.00
Total amount in issue after this issuance:     R6,750,000,000.00

Instrument type:                               Unsecured Subordinated Floating Rate Notes
Bond code:                                     OML12
Nominal issued:                                R2,000,000,000.00
Issue price:                                   100%
Coupon rate:                                   5.263% (3 Month Jibar as at 09 November 2020 of 3.333%
                                               plus 193bps)
Coupon rate indicator:                         Floating
Trade type:                                    Price
Final maturity date:                           12 November 2025
Books close date(s):                           2 February, 2 May, 2 August, 2 November
Interest payment date(s):                      12 February, 12 May, 12 August, 12 November
Last day to register:                          By 17h00 on 1 February, 1 May, 1 August, 1 November
Issue date:                                    12 November 2020
Date convention:                               Following
Interest commencement date:                    12 November 2020
First interest payment date:                   12 February 2021
ISIN:                                          ZAG000172412

Additional information:                         Senior Unsecured Floating Rate

The Applicable Pricing Supplement is available at:
https://www.oldmutual.com/investor-relations/debt-investors and
https://www.jse.co.za/content/JSEPricingSupplementsItems/2020/OML12%20PricingSupplement1211.PDF.

The note relating to the new financial instrument (“Note”) will be dematerialised in the Central Securities
Depository (“CSD”) and settlement will take place electronically in terms of JSE Rules.

Menique Botha                                  +27 (10) 234 8720

11 November 2020
Debt Sponsor: Nedbank CIB, a division of Nedbank Limited

Date: 11-11-2020 01:00:00
Produced by the JSE SENS Department. The SENS service is an information dissemination service administered by the JSE Limited ('JSE'). 
The JSE does not, whether expressly, tacitly or implicitly, represent, warrant or in any way guarantee the truth, accuracy or completeness of
 the information published on SENS. The JSE, their officers, employees and agents accept no liability for (or in respect of) any direct, 
indirect, incidental or consequential loss or damage of any kind or nature, howsoever arising, from the use of SENS or the use of, or reliance on,
 information disseminated through SENS."
BOLDM,11 Nov 2020,"Credit rating - BOLDM

OLD MUTUAL LIFE ASSURANCE COMPANY (SOUTH AFRICA) LIMITED
Registration number 1999/004643/06
JSE alpha code: BOLDM
(""OMLACSA” or the ""Company"")

CREDIT RATING

OMLACSA will be issuing unsecured deferrable subordinated notes (“notes”) on or about 12 November 2020. In this
regard, S&P Global Ratings has assigned its ‘zaA+’ South Africa national scale issue rate to the notes.

OMLACSA’s current South Africa long- and short-term national scale ratings are ‘zaAAA’ and ‘zaA-1+’ respectively.

For commentary on the credit rating please refer to the S&P Global Ratings's press release on their website: www
.standardandpoors.com.


11 November 2020
Debt Sponsor: Nedbank CIB, a division of Nedbank Limited

Date: 11-11-2020 11:26:00
Produced by the JSE SENS Department. The SENS service is an information dissemination service administered by the JSE Limited ('JSE'). 
The JSE does not, whether expressly, tacitly or implicitly, represent, warrant or in any way guarantee the truth, accuracy or completeness of
 the information published on SENS. The JSE, their officers, employees and agents accept no liability for (or in respect of) any direct, 
indirect, incidental or consequential loss or damage of any kind or nature, howsoever arising, from the use of SENS or the use of, or reliance on,
 information disseminated through SENS."
Change in Directorate,3 Nov 2020,"Change in Directorate

Old Mutual Limited
Incorporated in the Republic of South Africa
Registration number: 2017/235138/06
ISIN: ZAE000255360
LEI: 213800MON84ZWWPQCN47
JSE Share Code: OMU
NSX Share Code: OMM
MSE Share Code: OMU
ZSE Share Code: OMU
(""Old Mutual"" or “the Company”)


Ref 32/20
3 November 2020


CHANGE IN DIRECTORATE


In compliance with rule 3.59 of the JSE Listings Requirements, Old Mutual is
pleased to announce that Ms. Olufunke (Funke) Ighodaro has been appointed as an
independent non-executive director of Old Mutual.    Her appointment is subject to
the approval of the Prudential Authority in terms of the Insurance Act No 18 of
2017.


Funke is a commercially astute and experienced business leader who has served on
the boards of several private and publicly listed companies, bringing diverse
and extensive leadership experience and expertise in a large number of business
disciplines, but specifically in finance and business strategy, and governance
and risk management. She will serve on the Board’s Audit, Actuarial and Risk
committees.


Funke holds a BSc (Honours) degree from Salford University, is a Fellow of the
Institute of Chartered Accountants in England and Wales and accredited as a
Chartered Accountant with SAICA.     She is a former CFO of Tiger Brands Limited
and Primedia Limited and an Executive Director of Barloworld Limited and of
9mobile (Nigeria’s fourth largest Telco).    She founded and led the private equity
business of Kagiso Trust Investment Group and is currently a non-executive
director of Massmart Holdings Limited and an independent member of the investment
committee of CellC.    She was formerly a non-exeuctive director of Datatec Limited
and Transaction Capital Limited.


The Old Mutual Board would like to welcome Funke as a director and look forward
to working with her.


Sandton
Sponsors

Johannesburg Stock           Merrill Lynch South Africa (Pty) Limited
Exchange

Namibia                      PSG Wealth Management (Namibia) (Proprietary)
                             Limited

Zimbabwe                     Imara Capital Zimbabwe plc

Malawi                       Stockbrokers Malawi Limited


Enquiries


Investor Relations
Sizwe Ndlovu                 T: +27 (0)11 217 1163
Head of Investor Relations   E: tndlovu6@oldmutual.com


Tokelo Mulaudzi              T: +27 (0)11 217 1042
Investor Relations Manager   E: tmulaudzi3@oldmutual.com



Communications
Tabby Tsengiwe               T: +27 (11) 217 1953
Head of Communications       M: +27 (0)60 547 4947
                             E: ttsengiwe@oldmutual.com



Notes to Editors


Old Mutual is a premium African financial services Group that offers a broad
spectrum of financial solutions to retail and corporate customers across key
markets segments in 14 countries. Old Mutual's primary operations are in South
Africa and the rest of Africa, and we have a niche business in China. With 175
years of heritage across sub-Saharan Africa, we are a crucial part of the
communities we serve and broader society on the continent.


For further information on Old Mutual, and its underlying businesses, please
visit the corporate website at www.oldmutual.com.

Date: 03-11-2020 09:00:00
Produced by the JSE SENS Department. The SENS service is an information dissemination service administered by the JSE Limited ('JSE'). 
The JSE does not, whether expressly, tacitly or implicitly, represent, warrant or in any way guarantee the truth, accuracy or completeness of
 the information published on SENS. The JSE, their officers, employees and agents accept no liability for (or in respect of) any direct, 
indirect, incidental or consequential loss or damage of any kind or nature, howsoever arising, from the use of SENS or the use of, or reliance on,
 information disseminated through SENS."
Appointment of debt officer,28 Oct 2020,"Appointment of debt officer

OLD MUTUAL LIMITED                                  OLD MUTUAL INSURE LIMITED
Incorporated in the Republic of South Africa        (Incorporated in the Republic of South Africa)
Registration number: 2017/235138/06                 (Registration number 1970/006619/06)
JSE alpha code: OMLI                                JSE alpha code: MFEI
(“Old Mutual”)                                      (“Old Mutual Insure”)

OLD MUTUAL LIFE ASSURANCE COMPANY (SOUTH AFRICA) LIMITED
Registration number 1999/004643/06
JSE alpha code: OLDM
(“OMLACSA”)

(collectively “the Companies”)

APPOINTMENT OF DEBT OFFICER

In compliance with the Debt Listings Requirements of the JSE Limited, debt holders are advised that
Martin van der Walt, in his capacity as Group Treasurer of Old Mutual, Old Mutual Insure and
OMLACSA has been appointed as the debt officer of the Companies with effect from 31 October 2020.

The boards of the Companies confirm that they have considered and are satisfied with the
competence, qualifications and experience of the newly appointed debt officer.

The contact details of the debt officer are as follows:

Telephone:      +27 (0) 11 217 1495
Email:          MVanDerWalt5@oldmutual.com


Date: 28 October 2020
Debt Sponsor: Nedbank Corporate and Investment Banking

Date: 28-10-2020 01:26:00
Produced by the JSE SENS Department. The SENS service is an information dissemination service administered by the JSE Limited ('JSE'). 
The JSE does not, whether expressly, tacitly or implicitly, represent, warrant or in any way guarantee the truth, accuracy or completeness of
 the information published on SENS. The JSE, their officers, employees and agents accept no liability for (or in respect of) any direct, 
indirect, incidental or consequential loss or damage of any kind or nature, howsoever arising, from the use of SENS or the use of, or reliance on,
 information disseminated through SENS."
Internal transfer of Nedbank Group Limited shares from OMLACSA to Old Mutual Emerging Markets Proprietary Limited,16 Oct 2020,"Internal transfer of Nedbank Group Limited shares from OMLACSA to Old Mutual Emerging Markets Proprietary Limited

OLD MUTUAL LIFE ASSURANCE COMPANY (SOUTH AFRICA) LIMITED
Registration number 1999/004643/06
JSE alpha code: OLDM
(“OMLACSA”)

INTERNAL TRANSFER OF NEDBANK GROUP LIMITED (“NEDBANK”) SHARES FROM OMLACSA TO OLD MUTUAL
EMERGING MARKETS PROPRIETARY LIMITED (“OMEM”)

OMLACSA hereby notifies its debt investors that it intends to transfer 62 131 692 Nedbank ordinary shares
(“Nedbank shares”) internally to OMEM (“the Transaction”). OMLACSA and OMEM are both wholly owned
subsidiaries of Old Mutual Limited (“OML”). The Transaction is subject to receiving the necessary regulatory
approval and will result in greater capital efficiency for the group.

The Transaction will have no impact on the financial results and net assets of OML as this transaction does not
change the total number of Nedbank shares held by the Old Mutual group. In the separate financial statements
of OMLACSA, the Transaction will result in a reduction in the net asset value equivalent to the market value of
the Nedbank shares transferred to OMEM (at 30 June 2020, the market value of the Nedbank shares, based on
a share price of R101.55 per share, was c.R6,3 billion). The net asset value of OMLACSA will change further by
the recognition of deferred tax on the Nedbank shares that remain within OMLACSA.

At the end of June 2020, the solvency ratio was 182% for the OML group and 208% for OMLACSA. Post the
Transaction, the solvency ratios of Old Mutual group and OMLACSA are expected to remain comfortably within
the solvency target ranges. This demonstrates the capital strength and resilience of our balance sheet.


16 October 2020
Debt Sponsor: Nedbank CIB, a division of Nedbank Limited

Date: 16-10-2020 10:00:00
Produced by the JSE SENS Department. The SENS service is an information dissemination service administered by the JSE Limited ('JSE'). 
The JSE does not, whether expressly, tacitly or implicitly, represent, warrant or in any way guarantee the truth, accuracy or completeness of
 the information published on SENS. The JSE, their officers, employees and agents accept no liability for (or in respect of) any direct, 
indirect, incidental or consequential loss or damage of any kind or nature, howsoever arising, from the use of SENS or the use of, or reliance on,
 information disseminated through SENS."
Dealings in Securities on behalf of Employee Share Incentive Scheme,16 Sep 2020,"Dealings in Securities on behalf of Employee Share Incentive Scheme

Old Mutual Limited
Incorporated in the Republic of South Africa
Registration number: 2017/235138/06
ISIN: ZAE000255360
LEI: 213800MON84ZWWPQCN47
JSE Share Code: OMU
NSX Share Code: OMM
MSE Share Code: OMU
ZSE Share Code: OMU
(""Old Mutual"" or “the Company”)


Ref 31/20
16 September 2020


DEALINGS IN SECURITIES ON BEHALF OF EMPLOYEE SHARE INCENTIVE SCHEME
In compliance with the Listings Requirements of the JSE Limited the following
information is provided in respect of trading by an employee incentive scheme:


                                  Old Mutual Limited Broad-Based Black
 Name of the Scheme
                                  Economic Empowerment Employee Trust
 Class of security                Old Mutual Ordinary shares
                                  Purchase of Old Mutual Ordinary Shares in a
 Nature of transactions           hedging transaction in respect of the ESOP
                                  awards.
 Type of trade                    On-market
 Date of transaction              9 September 2020
 Number of shares                 797 000
 Price per share                  R11.2684
 Value                            R8 980 914.80


Sandton


Sponsors

Johannesburg Stock           Merrill Lynch South Africa (Pty) Limited
Exchange

Namibia                      PSG Wealth Management (Namibia) (Proprietary)
                             Limited

Zimbabwe                     Imara Capital Zimbabwe plc

Malawi                       Stockbrokers Malawi Limited


Enquiries

Investor Relations
Sizwe Ndlovu                 T: +27 (0)11 217 1163
Head of Investor Relations   E: tndlovu6@oldmutual.com


Tokelo Mulaudzi              T: +27 (0)11 217 1042
Investor Relations Manager   E: tmulaudzi3@oldmutual.com


Communications
Tabby Tsengiwe               T: +27 (11) 217 1953
Head of Communications       M: +27 (0)60 547 4947
                             E: ttsengiwe@oldmutual.com


Notes to Editors


Old Mutual is a premium African financial services Group that offers a broad
spectrum of financial solutions to retail and corporate customers across key
markets segments in 14 countries. Old Mutual's primary operations are in South
Africa and the rest of Africa, and we have a niche business in China. With 175
years of heritage across sub-Saharan Africa, we are a crucial part of the
communities we serve and broader society on the continent.


For further information on Old Mutual, and its underlying businesses, please
visit the corporate website at www.oldmutual.com.

Date: 16-09-2020 05:15:00
Produced by the JSE SENS Department. The SENS service is an information dissemination service administered by the JSE Limited ('JSE'). 
The JSE does not, whether expressly, tacitly or implicitly, represent, warrant or in any way guarantee the truth, accuracy or completeness of
 the information published on SENS. The JSE, their officers, employees and agents accept no liability for (or in respect of) any direct, 
indirect, incidental or consequential loss or damage of any kind or nature, howsoever arising, from the use of SENS or the use of, or reliance on,
 information disseminated through SENS."
Notice of availability of interim results of Old Mutual Limited,1 Sep 2020,"Notice of availability of interim results of Old Mutual Limited

Old Mutual Limited
Incorporated in the Republic of South Africa
Registration number: 2017/235138/06
JSE alpha code: OMLI
(""Old Mutual"" or “the Company”)


NOTICE OF AVAILABILITY OF INTERIM RESULTS OF OLD MUTUAL LIMITED

The unaudited interim results for the six months ended 30 June 2020 of Old Mutual have been publicly released.

The interim results are available for inspection on the Old Mutual website at https://www.oldmutual.com.

01 September 2020
Debt Sponsor: Nedbank CIB, a division of Nedbank Limited

Date: 01-09-2020 07:40:00
Produced by the JSE SENS Department. The SENS service is an information dissemination service administered by the JSE Limited ('JSE'). 
The JSE does not, whether expressly, tacitly or implicitly, represent, warrant or in any way guarantee the truth, accuracy or completeness of
 the information published on SENS. The JSE, their officers, employees and agents accept no liability for (or in respect of) any direct, 
indirect, incidental or consequential loss or damage of any kind or nature, howsoever arising, from the use of SENS or the use of, or reliance on,
 information disseminated through SENS."
