headline,link
"MultiChoice, Vivendi to team up on new Africa tv productions",https://www.moneyweb.co.za/news/companies-and-deals/multichoice-vivendi-to-team-up-on-new-africa-tv-productions/
Stefanutti Stocks cuts some losses and the rise of telemedicine,https://www.moneyweb.co.za/moneyweb-radio/moneyweb-now/stefanutti-stocks-cuts-some-losses-and-the-rise-of-telemedicine/
MultiChoice het nou meer as 20 miljoen intekenare,https://www.moneyweb.co.za/moneyweb-radio/rsg-geldsake/multichoice-het-nou-meer-as-20-miljoen-intekenare/
MultiChoice to launch new Netflix integrated decoder,https://www.moneyweb.co.za/moneyweb-radio/safm-market-update/multichoice-to-launch-new-netflix-integrated-decoder/
MultiChoice reports 68% rise in half-year profit,https://www.moneyweb.co.za/news/companies-and-deals/multichoice-reports-68-rise-in-half-year-profit/
"Vaccine news lifts markets, Raubex results and business confidence",https://www.moneyweb.co.za/moneyweb-radio/moneyweb-now/vaccine-news-lifts-markets-raubex-results-and-business-confidence/
Market Watcher,https://www.moneyweb.co.za/moneyweb-radio/safm-market-update/market-watcher-238/
Multichoice sees 45% jump in half-year profit,https://www.moneyweb.co.za/news/companies-and-deals/multichoice-sees-45-jump-in-half-year-profit/
Jooste: What might the psychologists say?,https://www.moneyweb.co.za/news/companies-and-deals/jooste-what-might-the-psychologists-say/
France’s Canal+ buys stake in MultiChoice; disrupting the new normal and does the JSE need fixing?,https://www.moneyweb.co.za/moneyweb-radio/moneyweb-now/frances-canal-buys-stake-in-multichoice-disrupting-the-new-normal-and-does-the-jse-need-fixing/
"Risk-taking boosts rand, stock market",https://www.moneyweb.co.za/news-fast-news/risk-taking-boosts-rand-stock-market/
France’s Canal+ buys stake in MultiChoice Group,https://www.moneyweb.co.za/news/companies-and-deals/frances-canal-buys-stake-in-multichoice-group/
Explained: Why DStv will carry rival streaming services,https://www.moneyweb.co.za/news/companies-and-deals/explained-why-dstv-will-carry-rival-streaming-services/
"FOMC keeps rates at zero, Sygnia results and understanding listed debt",https://www.moneyweb.co.za/moneyweb-radio/moneyweb-now/fomc-keeps-rates-at-zero-sygnia-results-and-understanding-listed-debt/
"Netflix, Amazon Prime Video coming to new DStv Explora decoders",https://www.moneyweb.co.za/news/companies-and-deals/netflix-amazon-prime-video-coming-to-new-dstv-explora-decoders/
