headline,link
"Resilient delivers dividends, but SA properties devalued by R813m",https://www.moneyweb.co.za/investing/property/resilient-delivers-dividends-but-sa-properties-devalued-by-r813m/
Banking results expected this week and ARB foresees tough recovery,https://www.moneyweb.co.za/moneyweb-radio/moneyweb-now/banking-results-expected-this-week-and-arb-foresees-tough-recovery/
Nepi Rockcastle sees 32% decline in interim distributable earnings,https://www.moneyweb.co.za/news/companies-and-deals/nepi-rockcastle-sees-32-decline-in-distributable-earnings/
Investors insure themselves against financial fraud,https://www.moneyweb.co.za/news/companies-and-deals/investors-are-girding-themselves-for-an-onslaught-of-financial-fraud/
How far the JSE’s biggest companies have fallen,https://www.moneyweb.co.za/news/markets/how-far-the-jses-biggest-companies-have-fallen/
Another bad day for the JSE,https://www.moneyweb.co.za/news/markets/another-bad-day-for-the-jse/
Resilient CEO sees ‘positive outcome’ from FSCA investigation,https://www.moneyweb.co.za/news/companies-and-deals/resilient-ceo-sees-positive-outcome-from-fsca-investigation/
You can now insure your equities against management dishonesty,https://www.moneyweb.co.za/news/industry/you-can-now-insure-your-equities-against-management-dishonesty/
How the JSE has changed in 10 years,https://www.moneyweb.co.za/investing/how-the-jse-has-changed-in-10-years/
Capital flight: SA property companies invest billions more offshore,https://www.moneyweb.co.za/news/companies-and-deals/capital-flight-sa-property-companies-invest-billions-more-offshore/
FSCA closes Nepi Rockcastle investigation,https://www.moneyweb.co.za/news/companies-and-deals/fsca-closes-nepi-rockcastle-investigation/
FSCA clears Resilient companies of insider trading,https://www.moneyweb.co.za/in-depth/investigations/fsca-clears-resilient-companies-of-insider-trading-allegations/
Restructured Resilient posts lower dividends,https://www.moneyweb.co.za/investing/property/restructured-resilient-posts-lower-dividends/
SA’s listed property conundrum,https://www.moneyweb.co.za/investing/sas-listed-property-conundrum/
Viceroy sinks teeth into Nepi Rockcastle,https://www.moneyweb.co.za/moneyweb-radio/viceroy-sinks-teeth-into-nepi-rockcastle/
